{
  "id": "stm32cube-u5",
  "name": "STM32CubeU5 device package",
  "purpose": "sdk",
  "status": "scaffold_only",
  "host_platforms": [
    "any"
  ],
  "tools": [
    "CMSIS device headers",
    "startup sources",
    "STM32U5 HAL and TrustZone examples"
  ],
  "packages": [],
  "dependencies": [
    "arm-none-eabi",
    "cmake",
    "ninja"
  ],
  "record_note": "Upstream: https://github.com/STMicroelectronics/STM32CubeU5. Pin one release and record secure/non-secure device startup and link support for STM32U575ZIT6."
}
